{
  "$schema": "https://json-schema.org/draft/2020-12/schema",
  "$id": "technical-decision.schema.json",
  "title": "Embedded Technical Decision",
  "type": "object",
  "required": ["decision_id", "run_id", "solution", "impact", "dependencies", "risks", "verification_plan", "rollback", "unresolved_items"],
  "properties": {
    "decision_id": {"type": "string"},
    "run_id": {"type": "string"},
    "solution": {"type": "string"},
    "alternatives_rejected": {"type": "array", "items": {"type": "string"}},
    "impact": {"type": "array", "items": {"type": "string"}},
    "dependencies": {"type": "array", "items": {"type": "string"}},
    "risks": {"type": "array", "items": {"type": "string"}},
    "verification_plan": {"type": "array", "items": {"type": "string"}},
    "rollback": {"type": "string"},
    "unresolved_items": {"type": "array", "items": {"type": "string"}},
    "evidence_refs": {"type": "array", "items": {"type": "string"}},
    "consumed_refs": {"type": "array", "items": {"type": "string"}}
  },
  "additionalProperties": false
}
